{
  "v": "orch.cli/2.0",
  "ok": true,
  "data": {
    "target": "import.v1",
    "name": "import.v1",
    "cli": "orch import v1",
    "summary": "Import a v1 workspace: its tickets, with the v1 history and files; asks for your passphrase once.",
    "who": "human",
    "usage": "orch import v1 PATH [--dry-run]",
    "pre": [
      "workspace_exists",
      "v1_workspace",
      "user_presence",
      "text_clean"
    ],
    "emits": [
      "artifact.added",
      "log.added",
      "question.asked",
      "status.changed",
      "ticket.closed",
      "ticket.created",
      "ticket.updated"
    ],
    "input": {
      "type": "object",
      "description": "Import a v1 workspace: its tickets, with the v1 history and files; asks for your passphrase once.",
      "properties": {
        "path": {
          "type": "string",
          "description": "the v1 workspace (the project folder or its orchestrator folder)",
          "x-metavar": "PATH"
        }
      },
      "x-positional": [
        "path"
      ],
      "required": [
        "path"
      ],
      "additionalProperties": false
    },
    "output": {
      "text": "ok import.v1 {count} tickets ({events} events)\nnext: {next}",
      "json": {
        "type": "object",
        "properties": {
          "count": {
            "type": "integer",
            "minimum": 0
          },
          "already": {
            "type": "integer",
            "minimum": 0
          },
          "skipped": {
            "type": "integer",
            "minimum": 0
          },
          "events": {
            "type": "integer",
            "minimum": 0
          },
          "partial": {
            "type": "integer",
            "minimum": 0
          }
        },
        "required": [
          "count",
          "already",
          "skipped",
          "events",
          "partial"
        ],
        "additionalProperties": false
      }
    },
    "errors": [
      {
        "code": "not_found",
        "exit": 2,
        "retryable": false,
        "hint": "orch list",
        "fix": [
          "orch",
          "list"
        ]
      },
      {
        "code": "custody.no_batch",
        "exit": 3,
        "retryable": false,
        "hint": "use a passphrase device key (orch setup sets one up)",
        "fix": [
          "orch",
          "help"
        ]
      },
      {
        "code": "custody.no_key",
        "exit": 3,
        "retryable": false,
        "hint": "orch setup sets up your device key",
        "fix": [
          "orch",
          "help"
        ]
      },
      {
        "code": "custody.no_prompt",
        "exit": 3,
        "retryable": false,
        "hint": "run this command yourself, in your own terminal",
        "fix": [
          "orch",
          "help"
        ]
      },
      {
        "code": "custody.wrong_passphrase",
        "exit": 3,
        "retryable": false,
        "hint": "run the command again and type your passphrase",
        "fix": [
          "orch",
          "help"
        ]
      },
      {
        "code": "human_only",
        "exit": 3,
        "retryable": false,
        "hint": "orch ask or orch wait",
        "fix": [
          "orch",
          "describe",
          "ask"
        ]
      },
      {
        "code": "sign.cancelled",
        "exit": 3,
        "retryable": false,
        "hint": "run it again to review",
        "fix": [
          "orch",
          "help"
        ]
      },
      {
        "code": "tty.required",
        "exit": 3,
        "retryable": false,
        "hint": "run it in your terminal",
        "fix": [
          "orch",
          "help"
        ]
      },
      {
        "code": "lock.busy",
        "exit": 4,
        "retryable": true,
        "hint": "retry in a moment",
        "fix": [
          "orch",
          "status"
        ]
      },
      {
        "code": "parse.text",
        "exit": 6,
        "retryable": false,
        "hint": "orch describe import.v1",
        "fix": [
          "orch",
          "describe",
          "import.v1"
        ]
      },
      {
        "code": "members.stale",
        "exit": 9,
        "retryable": true,
        "hint": "retry; the person re-signs",
        "fix": [
          "orch",
          "status"
        ]
      }
    ]
  },
  "key": null,
  "seq": 0,
  "cursor": 0,
  "hints": []
}
