{
  "v": "orch.cli/2.0",
  "ok": true,
  "data": {
    "target": "follow_up.reschedule",
    "name": "follow_up.reschedule",
    "cli": "orch follow-up reschedule",
    "summary": "Move a follow-up's due time or event deadline.",
    "who": "human",
    "usage": "orch follow-up reschedule ID --when WHEN [--dry-run]",
    "pre": [],
    "emits": [
      "followup.rescheduled"
    ],
    "input": {
      "type": "object",
      "description": "Move a follow-up's due time or event deadline.",
      "properties": {
        "id": {
          "type": "string",
          "description": "follow-up ID"
        },
        "when": {
          "type": "string",
          "description": "new time as an ISO UTC instant"
        }
      },
      "x-positional": [
        "id"
      ],
      "required": [
        "id",
        "when"
      ],
      "additionalProperties": false
    },
    "output": {
      "text": "ok {key} followup.rescheduled {id} seq={seq}\nnext: {next}",
      "json": {
        "type": "object",
        "properties": {
          "id": {
            "type": "string"
          },
          "due": {
            "type": "string"
          },
          "deadline": {
            "type": "string"
          }
        },
        "required": [
          "id"
        ],
        "additionalProperties": false
      }
    },
    "errors": [
      {
        "code": "not_found",
        "exit": 2,
        "retryable": false,
        "hint": "orch list",
        "fix": [
          "orch",
          "list"
        ]
      },
      {
        "code": "addon.off",
        "exit": 3,
        "retryable": false,
        "hint": "tell the person; do not work around it",
        "fix": [
          "orch",
          "addon",
          "list"
        ]
      },
      {
        "code": "custody.no_key",
        "exit": 3,
        "retryable": false,
        "hint": "orch setup sets up your device key",
        "fix": [
          "orch",
          "help"
        ]
      },
      {
        "code": "custody.no_prompt",
        "exit": 3,
        "retryable": false,
        "hint": "run this command yourself, in your own terminal",
        "fix": [
          "orch",
          "help"
        ]
      },
      {
        "code": "custody.wrong_passphrase",
        "exit": 3,
        "retryable": false,
        "hint": "run the command again and type your passphrase",
        "fix": [
          "orch",
          "help"
        ]
      },
      {
        "code": "followup.denied",
        "exit": 3,
        "retryable": false,
        "hint": "read the denial code and resolve it before retrying",
        "fix": [
          "orch",
          "show"
        ]
      },
      {
        "code": "human_only",
        "exit": 3,
        "retryable": false,
        "hint": "orch ask or orch wait",
        "fix": [
          "orch",
          "describe",
          "ask"
        ]
      },
      {
        "code": "lock.busy",
        "exit": 4,
        "retryable": true,
        "hint": "retry in a moment",
        "fix": [
          "orch",
          "status"
        ]
      },
      {
        "code": "members.stale",
        "exit": 9,
        "retryable": true,
        "hint": "retry; the person re-signs",
        "fix": [
          "orch",
          "status"
        ]
      }
    ]
  },
  "key": null,
  "seq": 0,
  "cursor": 0,
  "hints": []
}
