{
  "v": "orch.cli/2.0",
  "ok": true,
  "data": {
    "target": "artifact.list",
    "name": "artifact.list",
    "cli": "orch artifact list",
    "summary": "List the ticket's artifacts.",
    "who": "read",
    "usage": "orch artifact list [REF]",
    "pre": [
      "ticket_exists",
      "ticket_visible"
    ],
    "emits": [],
    "input": {
      "type": "object",
      "description": "List the ticket's artifacts.",
      "properties": {
        "ref": {
          "type": "string",
          "description": "ticket REF (DEMO-0043, 43); default: your claim",
          "pattern": "^(?:(?:[A-Z][A-Z0-9]{0,15}-)?[0-9]+(?:/T[1-9][0-9]*)?|T[1-9][0-9]*)$",
          "x-metavar": "REF"
        }
      },
      "x-positional": [
        "ref"
      ],
      "required": [],
      "additionalProperties": false
    },
    "output": {
      "text": "ok {key} artifact.list {count}\nnext: {next}",
      "json": {
        "type": "object",
        "properties": {
          "count": {
            "type": "integer",
            "minimum": 0
          },
          "artifacts": {
            "type": "array",
            "items": {
              "type": "object",
              "properties": {
                "name": {
                  "type": "string"
                },
                "kind": {
                  "type": "string"
                },
                "ac": {
                  "type": "string"
                },
                "path": {
                  "type": "string"
                }
              },
              "required": [
                "name",
                "kind"
              ],
              "additionalProperties": false
            }
          }
        },
        "required": [
          "count",
          "artifacts"
        ],
        "additionalProperties": false
      }
    },
    "errors": [
      {
        "code": "ambiguous_ref",
        "exit": 2,
        "retryable": false,
        "hint": "name the ticket REF, for example DEMO-0043",
        "fix": [
          "orch",
          "status"
        ]
      },
      {
        "code": "not_found",
        "exit": 2,
        "retryable": false,
        "hint": "orch list",
        "fix": [
          "orch",
          "list"
        ]
      }
    ]
  },
  "key": null,
  "seq": 0,
  "cursor": 0,
  "hints": []
}
