{
  "v": "orch.cli/2.0",
  "ok": true,
  "data": {
    "topic": "work",
    "steps": [
      {
        "op": "status",
        "call": "orch status"
      },
      {
        "op": "claim",
        "call": "orch claim --next"
      },
      {
        "op": "task.next",
        "call": "orch task next"
      },
      {
        "op": "task.done",
        "call": "orch task done T3 --run --artifact out.log --ac AC2 -m 'what ran'"
      },
      {
        "op": "handoff",
        "call": "orch handoff -m 'where it stands'"
      },
      {
        "op": "submit",
        "call": "orch submit"
      }
    ]
  },
  "key": null,
  "seq": 0,
  "cursor": 0,
  "hints": [
    "orch describe CMD"
  ]
}
