{
  "v": "orch.cli/2.0",
  "ok": true,
  "data": {
    "target": "grant.revoke",
    "name": "grant.revoke",
    "cli": "orch grant revoke",
    "summary": "Revoke a grant; every session using it ends.",
    "who": "human",
    "usage": "orch grant revoke GRANT [--reason TEXT] [--dry-run]",
    "pre": [
      "workspace_exists",
      "role_allows",
      "user_presence",
      "text_clean"
    ],
    "emits": [
      "grant.revoked"
    ],
    "input": {
      "type": "object",
      "description": "Revoke a grant; every session using it ends.",
      "properties": {
        "grant": {
          "type": "string",
          "description": "grant id",
          "pattern": "^gr_[0-7][0-9A-HJKMNP-TV-Z]{25}$",
          "x-metavar": "GRANT"
        },
        "reason": {
          "type": "string",
          "description": "why",
          "x-metavar": "TEXT"
        }
      },
      "x-positional": [
        "grant"
      ],
      "required": [
        "grant"
      ],
      "additionalProperties": false
    },
    "output": {
      "text": "ok grant.revoked {grant} seq={seq}\nnext: {next}",
      "json": {
        "type": "object",
        "properties": {
          "grant": {
            "type": "string"
          }
        },
        "required": [
          "grant"
        ],
        "additionalProperties": false
      }
    },
    "errors": [
      {
        "code": "not_found",
        "exit": 2,
        "retryable": false,
        "hint": "orch list",
        "fix": [
          "orch",
          "list"
        ]
      },
      {
        "code": "custody.no_key",
        "exit": 3,
        "retryable": false,
        "hint": "orch setup sets up your device key",
        "fix": [
          "orch",
          "help"
        ]
      },
      {
        "code": "custody.no_prompt",
        "exit": 3,
        "retryable": false,
        "hint": "run this command yourself, in your own terminal",
        "fix": [
          "orch",
          "help"
        ]
      },
      {
        "code": "custody.wrong_passphrase",
        "exit": 3,
        "retryable": false,
        "hint": "run the command again and type your passphrase",
        "fix": [
          "orch",
          "help"
        ]
      },
      {
        "code": "human_only",
        "exit": 3,
        "retryable": false,
        "hint": "orch ask or orch wait",
        "fix": [
          "orch",
          "describe",
          "ask"
        ]
      },
      {
        "code": "role.denied",
        "exit": 3,
        "retryable": false,
        "hint": "ask an owner or maintainer",
        "fix": [
          "orch",
          "status"
        ]
      },
      {
        "code": "lock.busy",
        "exit": 4,
        "retryable": true,
        "hint": "retry in a moment",
        "fix": [
          "orch",
          "status"
        ]
      },
      {
        "code": "parse.text",
        "exit": 6,
        "retryable": false,
        "hint": "orch describe grant.revoke",
        "fix": [
          "orch",
          "describe",
          "grant.revoke"
        ]
      },
      {
        "code": "members.stale",
        "exit": 9,
        "retryable": true,
        "hint": "retry; the person re-signs",
        "fix": [
          "orch",
          "status"
        ]
      }
    ]
  },
  "key": null,
  "seq": 0,
  "cursor": 0,
  "hints": []
}
