{
  "v": "orch.cli/2.0",
  "ok": true,
  "data": {
    "target": "inbox",
    "name": "inbox",
    "cli": "orch inbox",
    "summary": "Tickets handed over from peer workspaces, and decisions on your tickets that wait has not handed over.",
    "who": "read",
    "usage": "orch inbox",
    "pre": [
      "workspace_exists"
    ],
    "emits": [],
    "input": {
      "type": "object",
      "description": "Tickets handed over from peer workspaces, and decisions on your tickets that wait has not handed over.",
      "properties": {},
      "required": [],
      "additionalProperties": false
    },
    "output": {
      "text": "ok inbox {count}\nnext: {next}",
      "json": {
        "type": "object",
        "properties": {
          "count": {
            "type": "integer",
            "minimum": 0
          },
          "items": {
            "type": "array",
            "items": {
              "type": "object",
              "properties": {
                "key": {
                  "$ref": "https://schemas.orch.dev/v2/common#/$defs/ticketKey"
                },
                "from": {
                  "type": "string"
                },
                "title": {
                  "type": "string"
                }
              },
              "required": [
                "key",
                "from",
                "title"
              ],
              "additionalProperties": false
            }
          },
          "decisions": {
            "type": "array",
            "items": {
              "type": "object",
              "properties": {
                "key": {
                  "$ref": "https://schemas.orch.dev/v2/common#/$defs/ticketKey"
                },
                "seq": {
                  "type": "integer",
                  "minimum": 0
                },
                "decision": {
                  "type": "string"
                }
              },
              "required": [
                "key",
                "seq",
                "decision"
              ],
              "additionalProperties": false
            }
          }
        },
        "required": [
          "count",
          "items",
          "decisions"
        ],
        "additionalProperties": false
      }
    },
    "errors": []
  },
  "key": null,
  "seq": 0,
  "cursor": 0,
  "hints": []
}
