{
  "v": "orch.cli/2.0",
  "ok": true,
  "data": {
    "target": "addon.list",
    "name": "addon.list",
    "cli": "orch addon list",
    "summary": "List the installed addons and whether each is enabled.",
    "who": "read",
    "usage": "orch addon list",
    "pre": [
      "workspace_exists"
    ],
    "emits": [],
    "input": {
      "type": "object",
      "description": "List the installed addons and whether each is enabled.",
      "properties": {},
      "required": [],
      "additionalProperties": false
    },
    "output": {
      "text": "ok addon.list {count}\nnext: {next}",
      "json": {
        "type": "object",
        "properties": {
          "count": {
            "type": "integer",
            "minimum": 0
          },
          "addons": {
            "type": "array",
            "items": {
              "type": "object",
              "properties": {
                "name": {
                  "type": "string"
                },
                "version": {
                  "type": "string"
                },
                "enabled": {
                  "type": "boolean"
                },
                "state": {
                  "type": "string"
                },
                "credential": {
                  "type": "string"
                },
                "settings": {
                  "type": "object",
                  "properties": {
                    "title": {
                      "type": [
                        "string",
                        "null"
                      ]
                    },
                    "schema": {
                      "type": "object"
                    }
                  },
                  "required": [
                    "title",
                    "schema"
                  ],
                  "additionalProperties": false
                },
                "capabilities": {
                  "type": "array",
                  "items": {
                    "type": "string"
                  }
                },
                "fields": {
                  "type": "object"
                },
                "paused": {
                  "type": "object",
                  "properties": {
                    "code": {
                      "type": "string"
                    },
                    "cause": {
                      "type": "string"
                    },
                    "reconnect": {
                      "type": "string"
                    }
                  },
                  "required": [
                    "code",
                    "cause"
                  ],
                  "additionalProperties": false
                }
              },
              "required": [
                "name",
                "version",
                "enabled",
                "state"
              ],
              "additionalProperties": false
            }
          }
        },
        "required": [
          "count",
          "addons"
        ],
        "additionalProperties": false
      }
    },
    "errors": []
  },
  "key": null,
  "seq": 0,
  "cursor": 0,
  "hints": []
}
