{
  "v": "orch.cli/2.0",
  "ok": true,
  "data": {
    "target": "reopen",
    "name": "reopen",
    "cli": "orch reopen",
    "summary": "Reopen a done or closed ticket; raises every gate's generation.",
    "who": "human",
    "usage": "orch reopen [REF] [--message TEXT] [--dry-run]",
    "pre": [
      "ticket_exists",
      "ticket_owner_or_maintainer",
      "user_presence",
      "text_clean"
    ],
    "emits": [
      "ticket.reopened"
    ],
    "input": {
      "type": "object",
      "description": "Reopen a done or closed ticket; raises every gate's generation.",
      "properties": {
        "ref": {
          "type": "string",
          "description": "ticket REF",
          "pattern": "^(?:(?:[A-Z][A-Z0-9]{0,15}-)?[0-9]+(?:/T[1-9][0-9]*)?|T[1-9][0-9]*)$",
          "x-metavar": "REF"
        },
        "message": {
          "type": "string",
          "description": "free text",
          "x-short": "m",
          "x-metavar": "TEXT"
        }
      },
      "x-positional": [
        "ref"
      ],
      "required": [],
      "additionalProperties": false
    },
    "output": {
      "text": "ok {key} ticket.reopened seq={seq}\nnext: {next}",
      "json": {
        "type": "object",
        "properties": {},
        "required": [],
        "additionalProperties": false
      }
    },
    "errors": [
      {
        "code": "ambiguous_ref",
        "exit": 2,
        "retryable": false,
        "hint": "name the ticket REF, for example DEMO-0043",
        "fix": [
          "orch",
          "status"
        ]
      },
      {
        "code": "not_found",
        "exit": 2,
        "retryable": false,
        "hint": "orch list",
        "fix": [
          "orch",
          "list"
        ]
      },
      {
        "code": "custody.no_key",
        "exit": 3,
        "retryable": false,
        "hint": "orch setup sets up your device key",
        "fix": [
          "orch",
          "help"
        ]
      },
      {
        "code": "custody.no_prompt",
        "exit": 3,
        "retryable": false,
        "hint": "run this command yourself, in your own terminal",
        "fix": [
          "orch",
          "help"
        ]
      },
      {
        "code": "custody.wrong_passphrase",
        "exit": 3,
        "retryable": false,
        "hint": "run the command again and type your passphrase",
        "fix": [
          "orch",
          "help"
        ]
      },
      {
        "code": "human_only",
        "exit": 3,
        "retryable": false,
        "hint": "orch ask or orch wait",
        "fix": [
          "orch",
          "describe",
          "ask"
        ]
      },
      {
        "code": "role.denied",
        "exit": 3,
        "retryable": false,
        "hint": "ask an owner or maintainer",
        "fix": [
          "orch",
          "status"
        ]
      },
      {
        "code": "sign.cancelled",
        "exit": 3,
        "retryable": false,
        "hint": "run it again to review",
        "fix": [
          "orch",
          "help"
        ]
      },
      {
        "code": "transition.refused",
        "exit": 3,
        "retryable": false,
        "hint": "orch show REF",
        "fix": [
          "orch",
          "show"
        ]
      },
      {
        "code": "tty.required",
        "exit": 3,
        "retryable": false,
        "hint": "run it in your terminal",
        "fix": [
          "orch",
          "help"
        ]
      },
      {
        "code": "lock.busy",
        "exit": 4,
        "retryable": true,
        "hint": "retry in a moment",
        "fix": [
          "orch",
          "status"
        ]
      },
      {
        "code": "parse.text",
        "exit": 6,
        "retryable": false,
        "hint": "orch describe reopen",
        "fix": [
          "orch",
          "describe",
          "reopen"
        ]
      },
      {
        "code": "members.stale",
        "exit": 9,
        "retryable": true,
        "hint": "retry; the person re-signs",
        "fix": [
          "orch",
          "status"
        ]
      }
    ]
  },
  "key": null,
  "seq": 0,
  "cursor": 0,
  "hints": []
}
