{
  "v": "orch.cli/2.0",
  "ok": true,
  "data": {
    "target": "schedule.list",
    "name": "schedule.list",
    "cli": "orch schedule list",
    "summary": "List manual schedules across visible tickets.",
    "who": "read",
    "usage": "orch schedule list [REF]",
    "pre": [],
    "emits": [],
    "input": {
      "type": "object",
      "description": "List manual schedules across visible tickets.",
      "properties": {
        "ref": {
          "type": "string",
          "description": "ticket REF (DEMO-0043, 43); default: your claim",
          "pattern": "^(?:(?:[A-Z][A-Z0-9]{0,15}-)?[0-9]+(?:/T[1-9][0-9]*)?|T[1-9][0-9]*)$",
          "x-metavar": "REF"
        }
      },
      "x-positional": [
        "ref"
      ],
      "required": [],
      "additionalProperties": false
    },
    "output": {
      "text": "ok schedule.list {total}",
      "json": {
        "type": "object",
        "properties": {
          "rows": {
            "type": "array",
            "items": {
              "type": "object"
            }
          },
          "total": {
            "type": "integer",
            "minimum": 0
          }
        },
        "required": [
          "rows",
          "total"
        ],
        "additionalProperties": false
      }
    },
    "errors": [
      {
        "code": "ambiguous_ref",
        "exit": 2,
        "retryable": false,
        "hint": "name the ticket REF, for example DEMO-0043",
        "fix": [
          "orch",
          "status"
        ]
      },
      {
        "code": "not_found",
        "exit": 2,
        "retryable": false,
        "hint": "orch list",
        "fix": [
          "orch",
          "list"
        ]
      },
      {
        "code": "addon.off",
        "exit": 3,
        "retryable": false,
        "hint": "tell the person; do not work around it",
        "fix": [
          "orch",
          "addon",
          "list"
        ]
      }
    ]
  },
  "key": null,
  "seq": 0,
  "cursor": 0,
  "hints": []
}
